{"id": "20260317_191205", "timestamp": "2026-03-17T19:12:05.850382", "description": "Gap of +2.20 suggests this dimension is a strong predictor. Increasing weight.", "config_changes": {"type": "weight_increase", "dimension": "singular_vision", "current_weight": 0.25, "new_weight": 0.3, "change": 0.04999999999999999, "gap_score": 2.2, "rationale": "Gap of +2.20 suggests this dimension is a strong predictor. Increasing weight."}, "status": "completed", "baseline_accuracy": 0.787, "new_accuracy": 0, "improvement": -0.787, "improvement_pct": -100.0, "sample_size": 200, "full_dataset": false, "decision": "REVERT", "completed_at": "2026-03-17T19:12:06.461735"}
{"id": "20260317_191429", "timestamp": "2026-03-17T19:14:29.868319", "description": "Gap of +1.98 suggests this dimension is a strong predictor. Increasing weight.", "config_changes": {"type": "weight_increase", "dimension": "boldness", "current_weight": 0.05, "new_weight": 0.1, "change": 0.05, "gap_score": 1.98, "rationale": "Gap of +1.98 suggests this dimension is a strong predictor. Increasing weight."}, "status": "completed", "baseline_accuracy": 0.787, "new_accuracy": 0, "improvement": -0.787, "improvement_pct": -100.0, "sample_size": 200, "full_dataset": false, "decision": "REVERT", "completed_at": "2026-03-17T19:14:29.870478"}
{"id": "20260317_191457", "timestamp": "2026-03-17T19:14:57.027589", "description": "Gap of +1.92 suggests this dimension is a strong predictor. Increasing weight.", "config_changes": {"type": "weight_increase", "dimension": "world_originality", "current_weight": 0.1, "new_weight": 0.15000000000000002, "change": 0.05000000000000002, "gap_score": 1.92, "rationale": "Gap of +1.92 suggests this dimension is a strong predictor. Increasing weight."}, "status": "completed", "baseline_accuracy": 0.787, "new_accuracy": 0, "improvement": -0.787, "improvement_pct": -100.0, "sample_size": 909, "full_dataset": true, "decision": "REVERT", "completed_at": "2026-03-17T19:14:57.031074"}
{"id": "20260317_191516", "timestamp": "2026-03-17T19:15:16.692323", "description": "Gap of +1.60 is lower than others. Decreasing weight slightly.", "config_changes": {"type": "weight_decrease", "dimension": "character_depth", "current_weight": 0.2, "new_weight": 0.17, "change": -0.03, "gap_score": 1.6, "rationale": "Gap of +1.60 is lower than others. Decreasing weight slightly."}, "status": "completed", "baseline_accuracy": 0.787, "new_accuracy": 0.8193139363749575, "improvement": 0.0323139363749575, "improvement_pct": 4.105963961239834, "sample_size": 909, "full_dataset": true, "decision": "KEEP", "completed_at": "2026-03-17T19:15:16.698550"}
{"id": "20260317_191852", "timestamp": "2026-03-17T19:18:52.694519", "description": "Gap of +1.69 is lower than others. Decreasing weight slightly.", "config_changes": {"type": "weight_decrease", "dimension": "dialogue_language", "current_weight": 0.1, "new_weight": 0.07, "change": -0.03, "gap_score": 1.69, "rationale": "Gap of +1.69 is lower than others. Decreasing weight slightly."}, "status": "completed", "baseline_accuracy": 0.787, "new_accuracy": 0.8191818559190913, "improvement": 0.032181855919091285, "improvement_pct": 4.089181184128499, "sample_size": 909, "full_dataset": true, "decision": "KEEP", "completed_at": "2026-03-17T19:18:52.700916"}
